1,陳,C108118115@nkust.edu.tw,C108118115,"第一堂, 第二堂, 第五堂, 第六堂, 第七堂","第二堂, 第三堂, 第四堂, 第五堂, 第六堂, 第七堂","第七堂, 第八堂, 第九堂","第二堂, 第三堂, 第四堂, 第五堂, 第六堂","第五堂, 第六堂, 第七堂"
2,黎,C108118146@nkust.edu.tw,C108118146,"第二堂, 第三堂, 第四堂, 第五堂, 第六堂, 第七堂","第五堂, 第六堂, 第七堂","第二堂, 第三堂, 第四堂, 第七堂, 第八堂, 第九堂","第二堂, 第三堂, 第四堂, 第七堂, 第八堂","第一堂, 第二堂, 第五堂, 第六堂, 第七堂"
3,梁,C108118123@nkust.edu.tw,C108118123,"第一堂, 第八堂, 第九堂","第一堂, 第八堂, 第九堂","第五堂, 第六堂, 第七堂, 第八堂, 第九堂","第五堂, 第六堂, 第七堂, 第八堂, 第九堂","第五堂, 第六堂, 第七堂, 第八堂, 第九堂"
4,魏,C108118126@nkust.edu.tw,C108118126,"第三堂, 第四堂, 第八堂, 第九堂","第一堂, 第八堂, 第九堂","第一堂, 第五堂, 第六堂","第五堂, 第六堂, 第九堂","第一堂, 第二堂, 第三堂, 第四堂, 第八堂, 第九堂"
5,林,C108118232@nkust.edu.tw,C108118232,"第二堂, 第三堂, 第四堂, 第五堂, 第六堂, 第七堂","第一堂, 第二堂, 第三堂, 第四堂, 第五堂, 第六堂, 第七堂","第七堂, 第八堂, 第九堂","第五堂, 第六堂, 第七堂","第五堂, 第六堂, 第七堂"
6,楊,C108118101@nkust.edu.tw,C108118101,"第一堂, 第八堂, 第九堂","第一堂, 第八堂, 第九堂","第一堂, 第五堂, 第六堂, 第七堂, 第八堂, 第九堂","第一堂, 第二堂, 第三堂, 第四堂, 第五堂, 第六堂, 第七堂, 第八堂, 第九堂","第一堂, 第二堂, 第三堂, 第四堂, 第五堂, 第六堂, 第七堂, 第八堂, 第九堂"
7,黃,C108118102@nkust.edu.tw,C108118102,第一堂,"第一堂, 第二堂, 第三堂, 第四堂","第一堂, 第二堂, 第五堂, 第六堂, 第七堂, 第八堂, 第九堂","第一堂, 第二堂, 第三堂, 第四堂, 第五堂, 第六堂, 第七堂, 第八堂, 第九堂","第一堂, 第二堂, 第三堂, 第四堂, 第五堂, 第六堂, 第七堂, 第八堂, 第九堂"
